{
  "buildable": true,
  "category": "MAJOR_DLC",
  "cost": [
    {
      "item": "BLACK_GOLD",
      "quantity": 20
    }
  ],
  "description": {
    "ar": "يحرق <color=#FD1D03>فحم التعفن</color> <sprite name=\"icon_MagmaStone\"> لتدفئة الطائفة في <color=#FD1D03>الشتاء</color>.",
    "de": "Verbrennt <color=#FD1D03>Fäulnisbrand</color> <sprite name=\"icon_MagmaStone\">, um den Kult im <color=#FD1D03>Winter</color> warmzuhalten.",
    "en": "Burns <color=#FD1D03>Rotburn</color> <sprite name=\"icon_MagmaStone\"> to warm the Cult in <color=#FD1D03>winter</color>.",
    "es": "Quema <color=#FD1D03>petrodumbre</color> <sprite name=\"icon_MagmaStone\"> para calentar la secta cuando llega el <color=#FD1D03>invierno</color>.",
    "fr": "Brûle du <color=#FD1D03>charbon putrescent</color> <sprite name=\"icon_MagmaStone\"> pour réchauffer le culte en <color=#FD1D03>hiver</color>.",
    "fr-CA": "Brûle du <color=#FD1D03>charbon putrescent</color> <sprite name=\"icon_MagmaStone\"> pour réchauffer la secte en <color=#FD1D03>hiver</color>.",
    "it": "Brucia <color=#FD1D03>marciolite</color> <sprite name=\"icon_MagmaStone\"> per riscaldare il Culto in <color=#FD1D03>inverno</color>.",
    "ja": "<color=#FD1D03>腐敗石</color> <sprite name=\"icon_MagmaStone\"> を燃やすことで、<color=#FD1D03>冬</color>の教団を温めてくれる",
    "ko": "<color=#FD1D03>겨울</color>에 <color=#FD1D03>부패석탄</color> <sprite name=\"icon_MagmaStone\">을 태워 교단을 따뜻하게 유지합니다.",
    "nl": "Verbrandt <color=#FD1D03>rotsteen</color> <sprite name=\"icon_MagmaStone\"> om de sekte warm te houden in de <color=#FD1D03>winter</color>.",
    "pt-BR": "Queima <color=#FD1D03>Putrefogo</color> <sprite name=\"icon_MagmaStone\"> para aquecer o Culto no <color=#FD1D03>inverno</color>.",
    "ru": "Печь для сжигания <color=#FD1D03>гнилогара</color> <sprite name=\"icon_MagmaStone\"> и отопления поселения в течение <color=#FD1D03>зимы</color>.",
    "tr": "<color=#FD1D03>Çürükateş</color> <sprite name=\"icon_MagmaStone\"> yakarak Tarikat'ı <color=#FD1D03>kışın</color> ısıtır.",
    "zh-CN": "燃烧<color=#FD1D03>腐烧</color><sprite name=\"icon_MagmaStone\">，在<color=#FD1D03>冬日</color>为教会供暖。",
    "zh-TW": "<color=#FD1D03>冬天</color>燃燒<color=#FD1D03>腐燃</color> <sprite name=\"icon_MagmaStone\"> 可以溫暖教會。"
  },
  "descriptionPlain": {
    "ar": "يحرق فحم التعفن لتدفئة الطائفة في الشتاء.",
    "de": "Verbrennt Fäulnisbrand, um den Kult im Winter warmzuhalten.",
    "en": "Burns Rotburn to warm the Cult in winter.",
    "es": "Quema petrodumbre para calentar la secta cuando llega el invierno.",
    "fr": "Brûle du charbon putrescent pour réchauffer le culte en hiver.",
    "fr-CA": "Brûle du charbon putrescent pour réchauffer la secte en hiver.",
    "it": "Brucia marciolite per riscaldare il Culto in inverno.",
    "ja": "腐敗石 を燃やすことで、冬の教団を温めてくれる",
    "ko": "겨울에 부패석탄 을 태워 교단을 따뜻하게 유지합니다.",
    "nl": "Verbrandt rotsteen om de sekte warm te houden in de winter.",
    "pt-BR": "Queima Putrefogo para aquecer o Culto no inverno.",
    "ru": "Печь для сжигания гнилогара и отопления поселения в течение зимы.",
    "tr": "Çürükateş yakarak Tarikat'ı kışın ısıtır.",
    "zh-CN": "燃烧腐烧，在冬日为教会供暖。",
    "zh-TW": "冬天燃燒腐燃 可以溫暖教會。"
  },
  "icon": "icons/structures/FURNACE_1.png",
  "id": "FURNACE_1",
  "menu": "MajorDLC/Winter",
  "name": {
    "ar": "فرن فحم التعفن",
    "de": "Fäulnisbrand-Ofen",
    "en": "Rotburn Furnace",
    "es": "Caldera de petrodumbre",
    "fr": "Fourneau à charbon putrescent",
    "fr-CA": "Fournaise à charbon putrescent",
    "it": "Fornace a marciolite",
    "ja": "腐敗石ストーブ",
    "ko": "부패석탄 화로",
    "nl": "Rotsteenoven",
    "pt-BR": "Fornalha Putrefogo",
    "ru": "Гнилогарная печь",
    "tr": "Çürükateş Sobası",
    "zh-CN": "腐烧火炉",
    "zh-TW": "腐燃爐"
  },
  "namePlain": {
    "ar": "فرن فحم التعفن",
    "de": "Fäulnisbrand-Ofen",
    "en": "Rotburn Furnace",
    "es": "Caldera de petrodumbre",
    "fr": "Fourneau à charbon putrescent",
    "fr-CA": "Fournaise à charbon putrescent",
    "it": "Fornace a marciolite",
    "ja": "腐敗石ストーブ",
    "ko": "부패석탄 화로",
    "nl": "Rotsteenoven",
    "pt-BR": "Fornalha Putrefogo",
    "ru": "Гнилогарная печь",
    "tr": "Çürükateş Sobası",
    "zh-CN": "腐烧火炉",
    "zh-TW": "腐燃爐"
  },
  "range": {
    "centerOffset": 0.6,
    "shape": "square",
    "size": 3
  },
  "size": {
    "h": 2,
    "w": 2
  },
  "thumb": "icons/structures/64/FURNACE_1.png",
  "upgradesFrom": null,
  "upgradesTo": [
    "FURNACE_2"
  ]
}
